{
  "$schema": "https://json-schema.org/draft/2020-12/schema",
  "$id": "https://scrollcase.dev/schema/v2/channel-manifest.schema.json",
  "title": "Box channel manifest",
  "description": "A small mutable pointer from a channel to the releases it currently serves. Signed independently from releases, so promoting a build never requires re-signing it.",
  "type": "object",
  "additionalProperties": false,
  "required": [
    "schemaVersion",
    "kind",
    "channel",
    "boxId",
    "target",
    "updatedAt",
    "cohortSalt",
    "releases"
  ],
  "properties": {
    "schemaVersion": {
      "const": 2
    },
    "kind": {
      "type": "string",
      "pattern": "^[a-z0-9]+(?:[.-][a-z0-9]+)*\\.channel$",
      "description": "Wire discriminator, \"<namespace>.channel\", carrying the same namespace as the releases it refers to."
    },
    "channel": {
      "enum": [
        "nightly",
        "beta",
        "stable"
      ]
    },
    "boxId": {
      "type": "string",
      "minLength": 1
    },
    "target": {
      "$ref": "https://scrollcase.dev/schema/v2/target.schema.json"
    },
    "updatedAt": {
      "type": "string",
      "minLength": 1
    },
    "cohortSalt": {
      "type": "string",
      "minLength": 1,
      "description": "Salt mixed into a client's rollout hash. It makes cohort assignment stable per client and unpredictable across channels, so a staged rollout cannot be gamed by reinstalling."
    },
    "releases": {
      "type": "array",
      "minItems": 1,
      "description": "Candidate releases in evaluation order. A client takes the first entry whose rollout cohort it falls into.",
      "items": {
        "type": "object",
        "additionalProperties": false,
        "required": [
          "version",
          "releaseManifestUrl",
          "rolloutPercentage"
        ],
        "properties": {
          "version": {
            "type": "string",
            "minLength": 1
          },
          "releaseManifestUrl": {
            "type": "string",
            "minLength": 1
          },
          "rolloutPercentage": {
            "type": "integer",
            "minimum": 1,
            "maximum": 100
          }
        }
      }
    }
  }
}
